"RISK_ID","SEARCH_TERM_ID","GOOGLE_INDEX","TITLE","LINK","PUBLISHED_DATE","SUMMARY","KEYWORDS","SENTIMENT_COMPOUND","SENTIMENT","SOURCE","QUALITY_SCORE"
"4","26","5","Kalshi makes move to court crypto traders with tokenized betting contracts","https://www.cnbc.com/2025/12/01/kalshi-makes-move-to-court-crypto-traders-with-tokenized-betting-contracts.html","2025-12-01T19:38:00Z","Kalshi bettors can now buy and sell tokenized versions of their wagers on Solana, the company told CNBC exclusively on Monday. It's the latest sign the prediction market company is deepening its push to win over the same cryptocurrency holders that have pumped billions of dollars of digital assets into its rival Polymarket.

Tokenization refers to creating a digital version of a real-world financial asset such as a stock, bond or treasury note. The resulting token, which can be held or traded li","blockchain solana, kalshi markets, solana bitcoin, trading tokens, decentralized ledger","0.875","Positive","CNBC","0"
"3","17","8","China Eyes Fresh Crackdown on Crypto Amid Resurgence in Speculative Trading","https://decrypt.co/350464/china-eyes-crackdown-crypto-resurgence-speculative-trading","2025-12-01T15:56:46Z","In brief Officials said speculative crypto activity has resurfaced, creating new challenges for financial risk control.

The PBOC reiterated that virtual currency transactions, including stablecoins, constitute illegal financial activity.

Despite restrictions, an estimated 59 million Chinese users continue accessing offshore platforms and decentralized tools.

Decrypt’s Art, Fashion, and Entertainment Hub. Discover SCENE

Chinese authorities are renewing their focus on stopping crypto trading i","virtual currencies, virtual currency, china pboc, speculative crypto, bank china","0.2732","Positive","Decrypt","0"
